{
  "contract_version": "ivk-intake-1.0",
  "operation": "new",
  "target_vc": null,
  "name": "US optic2 Ecosystem",
  "seed": [
    "GLW",
    "VIAV",
    "AXTI",
    "FN",
    "CIEN"
  ],
  "frame": "matrix",
  "thesis": "optic2_idx 구성 기업은 공통 산업·수요 동인에 노출될 가능성이 있으며, 기업별 제품·기능·실적 차이를 비교해 실제 Value Chain 연결, 병목 및 수혜 강도를 검증한다.",
  "questions": [
    "각 seed 기업의 핵심 제품, 기능 및 Value Chain 역할은 무엇인가?",
    "기업들이 공유하는 수요동인과 End Market은 무엇인가?",
    "핵심 공정·제품·기술 병목은 어디에 있는가?",
    "병목의 직접 및 간접 수혜기업은 누구인가?",
    "최근 5분기 실적, 사업부, 재고, 마진 및 증설에서 가설이 확인되는가?",
    "추가 조사하거나 제외해야 할 인접 기업과 연결은 무엇인가?"
  ],
  "scope": [
    "value_chain",
    "products",
    "processes",
    "technologies",
    "end_markets",
    "financials",
    "segment_results",
    "inventory",
    "capex",
    "earnings_call",
    "counter_evidence",
    "link_expansion"
  ],
  "known_links": [],
  "limitations": [
    "us_idx의 optic2_idx 편입은 조사 출발점이며 기업 간 공급·경쟁 관계를 입증하지 않는다.",
    "Seed는 최종 Value Chain 경계가 아니며 evidence에 따라 추가·제외할 수 있다.",
    "모든 관계는 공시, 어닝콜 또는 신뢰할 수 있는 원문 근거로 검증해야 한다.",
    "근거와 review 없이 후보를 confirmed로 자동 승격하지 않는다."
  ],
  "references": [
    "gs://signals/us_idx/optic2_idx"
  ],
  "options": {
    "periods": 5,
    "auto_expand": true,
    "write_policy": "approval_required"
  }
}
