{
  "contract_version": "ivk-intake-1.0",
  "operation": "new",
  "target_vc": null,
  "name": "kr_tse_write_validation",
  "seed": ["KR:131290|티에스이"],
  "frame": "svb",
  "thesis": "티에스이의 기존 Company 노드를 재사용하는 다국가 IVK write 경로를 검증한다.",
  "questions": ["기존 티에스이 Company ID를 유지하면서 후보 Value Chain에 연결되는가?"],
  "scope": ["value_chain", "company_identity", "provenance"],
  "known_links": [],
  "limitations": ["본 파일럿은 식별자와 write 멱등성 검증용이며 STI급 재무 커버리지를 주장하지 않는다."],
  "references": ["https://dart.fss.or.kr/dsaf001/main.do?rcpNo=20260515001493"],
  "options": {"periods": 5, "auto_expand": false, "write_policy": "approval_required"}
}
