{
  "contract_version": "ivk-intake-1.0",
  "operation": "new",
  "target_vc": null,
  "name": "us_nuclear",
  "seed": ["OKLO", "SMR", "LEU", "UEC"],
  "frame": "matrix",
  "thesis": "Advanced nuclear deployment may connect reactor developers with nuclear-fuel and uranium suppliers.",
  "questions": [
    "What role does each seed company play in the nuclear value chain?",
    "Which bottlenecks and beneficiaries are supported by collected evidence?"
  ],
  "scope": ["value_chain", "products", "processes", "end_markets", "counter_evidence"],
  "known_links": [],
  "limitations": ["This validation run uses TIKR company overviews for identity and business-scope evidence only."],
  "references": ["gs://signals/us_idx/nuclear_idx"],
  "options": {"periods": 5, "auto_expand": false, "write_policy": "approval_required"}
}
